{
  "$schema": "https://json-schema.org/draft/2020-12/schema",
  "$id": "vulnerability_candidates.schema.json",
  "title": "vulnerability_candidates.json input contract",
  "description": "생산자: access_analyzer(analyze). 직접 소비자: scenario_generator, reporter. 기준: docs/spec/m4-access_analyzer.md, 02-common-contract.md. 후보는 검증 대상이지 확정 취약점이 아니다. 계약이 바뀌면 소비자와 합의 후 같이 고친다.",
  "type": "object",
  "additionalProperties": false,
  "required": [
    "schema_version", "artifact_type", "artifact_id", "run_id", "iteration", "producer",
    "mode", "created_at", "status", "input_refs", "errors", "runtime_metrics", "data"
  ],
  "properties": {
    "schema_version": { "const": "0.3.0" },
    "artifact_type": { "const": "vulnerability_candidates" },
    "artifact_id": { "$ref": "#/$defs/nonEmptyString" },
    "run_id": { "$ref": "#/$defs/nonEmptyString" },
    "iteration": { "type": "integer", "minimum": 0 },
    "producer": { "const": "access_analyzer" },
    "mode": { "enum": ["diagnosis", "development"] },
    "created_at": { "type": "string", "format": "date-time" },
    "status": { "enum": ["completed", "partial", "failed"] },
    "input_refs": { "type": "array", "items": { "$ref": "#/$defs/artifactRef" } },
    "errors": { "type": "array", "items": { "$ref": "#/$defs/errorItem" } },
    "runtime_metrics": { "oneOf": [{ "$ref": "#/$defs/runtimeMetrics" }, { "type": "null" }] },
    "data": { "oneOf": [{ "$ref": "#/$defs/candidatesData" }, { "type": "null" }] }
  },
  "allOf": [{ "$ref": "#/$defs/statusRules" }],
  "$defs": {
    "nonEmptyString": { "type": "string", "minLength": 1 },
    "sha256": { "type": "string", "pattern": "^[0-9a-f]{64}$" },
    "artifactRef": {
      "type": "object",
      "additionalProperties": false,
      "required": ["artifact_id", "artifact_type", "iteration", "path", "sha256"],
      "properties": {
        "artifact_id": { "$ref": "#/$defs/nonEmptyString" },
        "artifact_type": { "$ref": "#/$defs/nonEmptyString" },
        "iteration": { "type": "integer", "minimum": 0 },
        "path": { "$ref": "#/$defs/nonEmptyString" },
        "sha256": { "$ref": "#/$defs/sha256" }
      }
    },
    "evidenceRef": {
      "type": "object",
      "additionalProperties": false,
      "required": ["evidence_id", "kind", "path", "sha256", "redacted"],
      "properties": {
        "evidence_id": { "$ref": "#/$defs/nonEmptyString" },
        "kind": { "enum": ["request", "response", "dom", "screenshot", "state", "execution_log"] },
        "path": { "$ref": "#/$defs/nonEmptyString" },
        "sha256": { "$ref": "#/$defs/sha256" },
        "redacted": { "type": "boolean" }
      }
    },
    "errorItem": {
      "type": "object",
      "additionalProperties": false,
      "required": ["code", "message", "item_ref", "retryable"],
      "properties": {
        "code": { "$ref": "#/$defs/nonEmptyString" },
        "message": { "$ref": "#/$defs/nonEmptyString" },
        "item_ref": { "type": ["string", "null"] },
        "retryable": { "type": "boolean" }
      }
    },
    "runtimeMetrics": {
      "type": "object",
      "additionalProperties": false,
      "required": ["duration_ms", "llm_calls", "input_tokens", "output_tokens", "peak_memory_mb"],
      "properties": {
        "duration_ms": { "type": ["integer", "null"], "minimum": 0 },
        "llm_calls": { "type": ["integer", "null"], "minimum": 0 },
        "input_tokens": { "type": ["integer", "null"], "minimum": 0 },
        "output_tokens": { "type": ["integer", "null"], "minimum": 0 },
        "peak_memory_mb": { "type": ["number", "null"], "minimum": 0 }
      }
    },
    "modelInfo": {
      "type": "object",
      "additionalProperties": false,
      "required": ["model_id", "model_version", "prompt_version", "temperature", "seed"],
      "properties": {
        "model_id": { "$ref": "#/$defs/nonEmptyString" },
        "model_version": { "$ref": "#/$defs/nonEmptyString" },
        "prompt_version": { "$ref": "#/$defs/nonEmptyString" },
        "temperature": { "type": ["number", "null"] },
        "seed": { "type": ["integer", "null"] }
      }
    },
    "candidate": {
      "type": "object",
      "additionalProperties": false,
      "required": [
        "candidate_id", "category", "vulnerability_type", "rule_id",
        "actor_account_id", "actor_role_id", "reference_account_id",
        "resource_ids", "source_request_ids", "workflow_id",
        "hypothesis", "expected_behavior", "expected_basis", "evidence_refs"
      ],
      "properties": {
        "candidate_id": { "$ref": "#/$defs/nonEmptyString" },
        "category": { "enum": ["authorization", "business_logic"] },
        "vulnerability_type": { "$ref": "#/$defs/nonEmptyString" },
        "rule_id": { "$ref": "#/$defs/nonEmptyString" },
        "actor_account_id": { "$ref": "#/$defs/nonEmptyString" },
        "actor_role_id": { "$ref": "#/$defs/nonEmptyString" },
        "reference_account_id": { "oneOf": [{ "$ref": "#/$defs/nonEmptyString" }, { "type": "null" }] },
        "resource_ids": { "type": "array", "minItems": 1, "items": { "$ref": "#/$defs/nonEmptyString" } },
        "source_request_ids": { "type": "array", "minItems": 1, "items": { "$ref": "#/$defs/nonEmptyString" } },
        "workflow_id": { "oneOf": [{ "$ref": "#/$defs/nonEmptyString" }, { "type": "null" }] },
        "hypothesis": { "$ref": "#/$defs/nonEmptyString" },
        "expected_behavior": { "$ref": "#/$defs/nonEmptyString" },
        "expected_basis": { "enum": ["rule", "inferred", "unknown"] },
        "evidence_refs": { "type": "array", "items": { "$ref": "#/$defs/evidenceRef" } }
      }
    },
    "candidatesData": {
      "type": "object",
      "additionalProperties": false,
      "required": ["source_graph_revision", "candidates", "model_info"],
      "properties": {
        "source_graph_revision": { "type": "integer", "minimum": 0 },
        "candidates": { "type": "array", "items": { "$ref": "#/$defs/candidate" } },
        "model_info": { "oneOf": [{ "$ref": "#/$defs/modelInfo" }, { "type": "null" }] }
      }
    },
    "statusRules": {
      "allOf": [
        {
          "if": { "properties": { "status": { "const": "completed" } } },
          "then": { "properties": { "errors": { "maxItems": 0 }, "data": { "$ref": "#/$defs/candidatesData" } } }
        },
        {
          "if": { "properties": { "status": { "const": "partial" } } },
          "then": { "properties": { "errors": { "minItems": 1 }, "data": { "$ref": "#/$defs/candidatesData" } } }
        },
        {
          "if": { "properties": { "status": { "const": "failed" } } },
          "then": { "properties": { "errors": { "minItems": 1 }, "data": { "type": "null" } } }
        }
      ]
    }
  }
}
