{
  "schema_version": "0.3.0",
  "artifact_type": "vulnerability_candidates",
  "artifact_id": "candidates_empty_001",
  "run_id": "run_demo_001",
  "iteration": 0,
  "producer": "access_analyzer",
  "mode": "development",
  "created_at": "2026-10-07T02:00:00Z",
  "status": "completed",
  "input_refs": [],
  "errors": [],
  "runtime_metrics": {
    "duration_ms": 10,
    "llm_calls": 0,
    "input_tokens": 0,
    "output_tokens": 0,
    "peak_memory_mb": 32
  },
  "data": {
    "source_graph_revision": 1,
    "candidates": [],
    "model_info": null
  }
}
