{
  "schema_version": "0.3.0",
  "artifact_type": "vulnerability_candidates",
  "artifact_id": "candidates_demo_001",
  "run_id": "run_demo_001",
  "iteration": 0,
  "producer": "access_analyzer",
  "mode": "development",
  "created_at": "2026-10-07T02:00:00Z",
  "status": "completed",
  "input_refs": [],
  "errors": [],
  "runtime_metrics": {
    "duration_ms": 10,
    "llm_calls": 0,
    "input_tokens": 0,
    "output_tokens": 0,
    "peak_memory_mb": 32
  },
  "data": {
    "source_graph_revision": 1,
    "candidates": [
      {
        "candidate_id": "candidate_idor_001",
        "category": "authorization",
        "vulnerability_type": "horizontal_access",
        "rule_id": "rule_candidate_idor_001",
        "actor_account_id": "account_user_a",
        "actor_role_id": "role_user",
        "reference_account_id": "account_user_b",
        "resource_ids": [
          "resource_order_b"
        ],
        "source_request_ids": [
          "request_read_order"
        ],
        "workflow_id": null,
        "hypothesis": "candidate_idor_001 검증 가설",
        "expected_behavior": "권한이 없거나 선행 조건을 만족하지 않으면 요청이 거부되어야 한다",
        "expected_basis": "rule",
        "evidence_refs": [
          {
            "evidence_id": "candidate_observation",
            "kind": "response",
            "path": "evidence/verifier/candidate_observation.json",
            "sha256": "eeeeeeeeeeeeeeeeeeeeeeeeeeeeeeeeeeeeeeeeeeeeeeeeeeeeeeeeeeeeeeee",
            "redacted": true
          }
        ]
      },
      {
        "candidate_id": "candidate_workflow_001",
        "category": "business_logic",
        "vulnerability_type": "workflow_step_bypass",
        "rule_id": "rule_candidate_workflow_001",
        "actor_account_id": "account_user_a",
        "actor_role_id": "role_user",
        "reference_account_id": "account_user_b",
        "resource_ids": [
          "resource_order_b"
        ],
        "source_request_ids": [
          "request_update_order"
        ],
        "workflow_id": "workflow_order_update",
        "hypothesis": "candidate_workflow_001 검증 가설",
        "expected_behavior": "권한이 없거나 선행 조건을 만족하지 않으면 요청이 거부되어야 한다",
        "expected_basis": "inferred",
        "evidence_refs": [
          {
            "evidence_id": "candidate_observation",
            "kind": "response",
            "path": "evidence/verifier/candidate_observation.json",
            "sha256": "eeeeeeeeeeeeeeeeeeeeeeeeeeeeeeeeeeeeeeeeeeeeeeeeeeeeeeeeeeeeeeee",
            "redacted": true
          }
        ]
      },
      {
        "candidate_id": "candidate_unplanned_001",
        "category": "authorization",
        "vulnerability_type": "role_escalation",
        "rule_id": "rule_candidate_unplanned_001",
        "actor_account_id": "account_user_a",
        "actor_role_id": "role_user",
        "reference_account_id": "account_user_b",
        "resource_ids": [
          "resource_order_b"
        ],
        "source_request_ids": [
          "request_read_order"
        ],
        "workflow_id": null,
        "hypothesis": "candidate_unplanned_001 검증 가설",
        "expected_behavior": "권한이 없거나 선행 조건을 만족하지 않으면 요청이 거부되어야 한다",
        "expected_basis": "unknown",
        "evidence_refs": [
          {
            "evidence_id": "candidate_observation",
            "kind": "response",
            "path": "evidence/verifier/candidate_observation.json",
            "sha256": "eeeeeeeeeeeeeeeeeeeeeeeeeeeeeeeeeeeeeeeeeeeeeeeeeeeeeeeeeeeeeeee",
            "redacted": true
          }
        ]
      }
    ],
    "model_info": null
  }
}
